title,id,genres,cast,director,poster_path,release_date,semantic_field
Farm to Fork to Love,814780,"Romance, TV Movie","Meggan Kaiser, Scot Cooper, Patty Lambert, Maurice Johnson, Shatoya McClintock",Sandra L. Martin,/ngcD1UZUr0pOG7AvZgvwjYEEsTr.jpg,2021-04-29,"Movie 'Farm to Fork to Love', directed by Sandra L. Martin, released on 2021-04-29.                         Average rating is 6.4 out of 10, and current popularity is 3.433.                                     Overview: 'Alice, a young and talented sous chef at NY's top restaurant, receives an invitation to judge a food competition for a prestigious annual fundraiser.'                                         Top cast includes: Meggan Kaiser, Scot Cooper, Patty Lambert, Maurice Johnson, Shatoya McClintock. Genres: Romance, TV Movie.                                            Available on: Amazon Prime Video, Pure Flix, Amazon Prime Video with Ads."
2025: The World Enslaved by a Virus,810511,"Adventure, Science Fiction, Thriller, Fantasy","Simon Wesely, Joshua Wesely, Matthew Dougan, Coby Gilyard, Isabelle Scheuermann",Joshua Wesely,/ooM6oRUDG65a7zzU5kIBfoWCeB3.jpg,2021-01-15,"Movie '2025: The World Enslaved by a Virus', directed by Joshua Wesely, released on 2021-01-15.                         Average rating is 1.8 out of 10, and current popularity is 5.87.                                     Overview: 'In a post-apocalyptic world brought on by the Coronavirus, communism runs rampant, meetings are forbidden and Christianity is illegal. A band of young believers launch an underground revolution to reunite Christians and regain freedom from their oppressive superiors.'                                         Top cast includes: Simon Wesely, Joshua Wesely, Matthew Dougan, Coby Gilyard, Isabelle Scheuermann. Genres: Adventure, Science Fiction, Thriller, Fantasy.                                            Available on: fuboTV."
Promises,821683,Drama,"Pierfrancesco Favino, Kelly Reilly, Jean Reno, Ginnie Watson, Cara Theobold",Amanda Sthers,/Mm539VC9Zoj3Yin0whEACfGPk9.jpg,2021-11-19,"Movie 'Promises', directed by Amanda Sthers, released on 2021-11-19.                         Average rating is 5.6 out of 10, and current popularity is 5.842.                                     Overview: 'When Alexander and Laura meet during a party what they feel for each other is obvious, but she’s about to get married and Alexander shares a daughter with his beautiful wife. Thanks in part to the support of his lifelong friends, Alexander's childhood memories constantly resurface, leading him to reflect on what was, what will be, and what could have been.'                                         Top cast includes: Pierfrancesco Favino, Kelly Reilly, Jean Reno, Ginnie Watson, Cara Theobold. Genres: Drama. Streaming providers unkown."
I Am Mortal,919269,"Science Fiction, Fantasy, Drama","Sean Gunn, Lauren Lindsey Donzis, Nina Kiri, Abraham Lewis, Eloise Smyth",Tony Aloupis,/3ZNbjTwJ36alybDWu7yKyMwXhGp.jpg,2021-11-18,"Movie 'I Am Mortal', directed by Tony Aloupis, released on 2021-11-18.                         Average rating is 4.575 out of 10, and current popularity is 3.994.                                     Overview: 'Set 200 years in the future, a small band of rebels face off against the status quo where humans have achieved immortality through genetic engineering'                                         Top cast includes: Sean Gunn, Lauren Lindsey Donzis, Nina Kiri, Abraham Lewis, Eloise Smyth. Genres: Science Fiction, Fantasy, Drama.                                            Available on: AMC+ Amazon Channel, AMC+ Roku Premium Channel."
Crossword Mysteries: Terminal Descent,783508,"TV Movie, Crime, Drama, Mystery, Romance","Lacey Chabert, Brennan Elliott, Barbara Niven, John Kapelos, Parveen Dosanjh",Peter Benson,/6H2nRC9GaFQNpMSzY54tGnGorNr.jpg,2021-02-14,"Movie 'Crossword Mysteries: Terminal Descent', directed by Peter Benson, released on 2021-02-14.                         Average rating is 7.0 out of 10, and current popularity is 5.749.                                     Overview: 'After volunteering to participate in a crossword solving competition with a new supercomputer, crossword puzzle editor Tess Harper finds herself swept into the investigation of the bizarre murder of a tech CEO'                                         Top cast includes: Lacey Chabert, Brennan Elliott, Barbara Niven, John Kapelos, Parveen Dosanjh. Genres: TV Movie, Crime, Drama, Mystery, Romance.                                            Available on: Hallmark Movies Now Amazon Channel, Hallmark Movies Now Apple TV Channel."
P!nk: All I Know So Far,807597,"Documentary, Music","Pink, Carey Hart, Willow Sage Hart",Michael Gracey,/vtoEBoGvrSJuDPfQ3rPELqIcG5e.jpg,2021-05-21,"Movie 'P!nk: All I Know So Far', directed by Michael Gracey, released on 2021-05-21.                         Average rating is 7.74 out of 10, and current popularity is 4.639.                                     Overview: 'A behind-the-scenes look at P!NK as she balances family and life on the road, leading up to her first Wembley Stadium performance on 2019's ""Beautiful Trauma"" world tour.'                                         Top cast includes: Pink, Carey Hart, Willow Sage Hart. Genres: Documentary, Music.                                            Available on: Amazon Prime Video, Amazon Prime Video with Ads."
Christmas at Castle Hart,874166,"TV Movie, Comedy, Romance, Drama","Lacey Chabert, Stuart Townsend, Ali Hardiman, Aoife Spratt, Ali White",Stefan Scaini,/vgDcBPhEOTvAd7BrmuoRc9jduib.jpg,2021-11-27,"Movie 'Christmas at Castle Hart', directed by Stefan Scaini, released on 2021-11-27.                         Average rating is 6.581 out of 10, and current popularity is 4.001.                                     Overview: 'Brooke Bennett goes to Ireland for Christmas to search for her Irish roots. While there, she meets Aiden Hart, Earl of Glaslough. Mistaken for an elite event planner, she’s hired to host his castle’s epic Christmas party.'                                         Top cast includes: Lacey Chabert, Stuart Townsend, Ali Hardiman, Aoife Spratt, Ali White. Genres: TV Movie, Comedy, Romance, Drama.                                            Available on: Peacock Premium, Hallmark Movies Now Amazon Channel, Hallmark Movies Now Apple TV Channel, Peacock Premium Plus."
Creating an Army of the Dead,831982,Documentary,"Zack Snyder, Deborah Snyder, Ana de la Reguera, Huma Qureshi, Dave Bautista",,/4Gbg2z4Kf026NDwyThYpdRpIYqV.jpg,2021-05-21,"Movie 'Creating an Army of the Dead', directed by None, released on 2021-05-21.                         Average rating is 6.0 out of 10, and current popularity is 5.774.                                     Overview: 'Zack Snyder and his Army of the Dead team dive into the film's wild stunts, groundbreaking effects and the evolution of the zombie genre.'                                         Top cast includes: Zack Snyder, Deborah Snyder, Ana de la Reguera, Huma Qureshi, Dave Bautista. Genres: Documentary.                                            Available on: Netflix."
Slumber Party Massacre,818543,"Horror, Comedy","Hannah Gonera, Frances Sholto-Douglas, Mila Rayne, Alex McGregor, Reze-Tiana Wessels",Danishka Esterhazy,/taybMcekWWhL7yuxPgYKXH5I1FY.jpg,2021-09-27,"Movie 'Slumber Party Massacre', directed by Danishka Esterhazy, released on 2021-09-27.                         Average rating is 5.3 out of 10, and current popularity is 5.771.                                     Overview: 'Dana, daughter of the only survivor of a massacre in 1993, is going on a weekend trip with her friends. After their car breaks down in the very same town where her mother once fought the Driller Killer, Dana and her friends must come face-to-face with the man who has haunted her mother’s life for the past 30 years.'                                         Top cast includes: Hannah Gonera, Frances Sholto-Douglas, Mila Rayne, Alex McGregor, Reze-Tiana Wessels. Genres: Horror, Comedy.                                            Available on: fuboTV, NBC, USA Network, Shudder Apple TV Channel."
The Death of David Cronenberg,875425,Horror,David Cronenberg,Caitlin Cronenberg,/kUqPIwr11iDdzMl09F9UEKqbfWk.jpg,2021-09-14,"Movie 'The Death of David Cronenberg', directed by Caitlin Cronenberg, released on 2021-09-14.                         Average rating is 6.1 out of 10, and current popularity is 2.47.                                     Overview: 'David Cronenberg stands in a softly lit bedroom and looks deeply into the camera before his gaze shifts to a motionless figure in the bed...'                                         Top cast includes: David Cronenberg. Genres: Horror. Streaming providers unkown."
No Man's Land,678491,"Drama, Thriller, Action","Frank Grillo, George Lopez, Jake Allyn, Jorge A. Jimenez, Andie MacDowell",Conor Allyn,/7PloiGUSH2OUWrk6ctchGhMOL3s.jpg,2021-01-22,"Movie 'No Man's Land', directed by Conor Allyn, released on 2021-01-22.                         Average rating is 6.433 out of 10, and current popularity is 2.456.                                     Overview: 'Late one night, Bill Greer and his son Jackson patrol their ranch when Jackson accidentally kills an immigrant Mexican boy. When Bill tries to take the blame for his son, Jackson flees south on horseback, becoming a gringo ""illegal alien"" in Mexico. Chased by Texas Rangers and Mexican federales, Jackson journeys across Mexico to seek forgiveness from the dead boy's father only to fall in love with the land he was taught to hate.'                                         Top cast includes: Frank Grillo, George Lopez, Jake Allyn, Jorge A. Jimenez, Andie MacDowell. Genres: Drama, Thriller, Action.                                            Available on: AMC+ Amazon Channel, IFC Films Unlimited Apple TV Channel."
The Parish,726527,"Horror, Thriller","Sanae Loutsis, Bill Oberst Jr., Angela DiMarco",David S. Hogan,/bIN2kfKhp3W4bjGD5L7obx9xROH.jpg,2021-03-16,"Movie 'The Parish', directed by David S. Hogan, released on 2021-03-16.                         Average rating is 6.2 out of 10, and current popularity is 2.637.                                     Overview: 'Strange events plague a recently widowed woman and her young daughter when they move to a small town.'                                         Top cast includes: Sanae Loutsis, Bill Oberst Jr., Angela DiMarco. Genres: Horror, Thriller.                                            Available on: Amazon Prime Video, Amazon Prime Video with Ads."
Cam Girls,792237,Romance,"Steve Aaron-Sipple, Abi Casson Thompson, Richard Kovacs, Kate Milner Evans, Antonia Johnstone",Scott Chambers,/9BolmRFhKYRc6f5gPfegjZ8U0V1.jpg,2021-01-30,"Movie 'Cam Girls', directed by Scott Chambers, released on 2021-01-30.                         Average rating is 6.5 out of 10, and current popularity is 5.685.                                     Overview: 'Jenna, Kelly and Ness have all found themselves isolated around lockdown. With little to do around the homes, and a lot of time on their hands, the girls interact with one another discussing their new sexual desires becoming unleashed with their partners via the internet. Diving into the world of BDSM, group and infidelity, will the ladies want to go further with these experimental sexual acts when they leave lockdown?'                                         Top cast includes: Steve Aaron-Sipple, Abi Casson Thompson, Richard Kovacs, Kate Milner Evans, Antonia Johnstone. Genres: Romance.                                            Available on: Cineverse."
Sweet River,717942,"Horror, Mystery","Lisa Kay, Martin Sacks, Geneviève Lemon, Rob Carlton, Eddie Baroo",Justin McMillan,/9kP8AGABidt3KTW9GD3s8SfdsFL.jpg,2021-04-23,"Movie 'Sweet River', directed by Justin McMillan, released on 2021-04-23.                         Average rating is 5.5 out of 10, and current popularity is 2.971.                                     Overview: 'Hannah's search for her son's body leads her to sleepy Billins, where her investigations uncover more than she expected and threaten to expose towns dark secrets....secrets that both the living and the dead will fight to protect.'                                         Top cast includes: Lisa Kay, Martin Sacks, Geneviève Lemon, Rob Carlton, Eddie Baroo. Genres: Horror, Mystery.                                            Available on: Amazon Prime Video, Epix Amazon Channel, Amazon Prime Video with Ads."
DC Showcase: Blue Beetle,791346,"Animation, Science Fiction, Action, Adventure","Matt Lanter, Jeff Bennett, Ashly Burch, David Kaye, Tom Kenny",Milo Neuman,/nIVjDSeIZGG4jPrNPLGXPKJhnj4.jpg,2021-07-27,"Movie 'DC Showcase: Blue Beetle', directed by Milo Neuman, released on 2021-07-27.                         Average rating is 5.8 out of 10, and current popularity is 4.672.                                     Overview: 'SUFFERIN' SCARABS! Silver Age Blue Beetle is back! Thrill to the adventures of Ted Kord, alias the Blue Beetle, as he teams up with fellow Charlton Comics heroes Captain Atom, The Questions and Nightshade to battle the nefarious finagler of feelings, Doctor Spectro!'                                         Top cast includes: Matt Lanter, Jeff Bennett, Ashly Burch, David Kaye, Tom Kenny. Genres: Animation, Science Fiction, Action, Adventure. Streaming providers unkown."
Come and Learn with Pibby!,892150,"Animation, Horror, Comedy, Fantasy","Nikki Castillo, Jack Stanton, Alex Newell, Marcus Toji, Jeff Bergman",Joey So,/ygxJedogKfsESIJUoNwZ1J73USn.jpg,2021-10-30,"Movie 'Come and Learn with Pibby!', directed by Joey So, released on 2021-10-30.                         Average rating is 5.6 out of 10, and current popularity is 2.679.                                     Overview: 'Pibby is ripped out of her safe, preschool world and thrown into unknøwn lands. She has to grow up, 💜LEARN💜, and become a b∆dass to stop the cartoon A₱⊙C⋀L¥⍴$∑//////////////////////'                                         Top cast includes: Nikki Castillo, Jack Stanton, Alex Newell, Marcus Toji, Jeff Bergman. Genres: Animation, Horror, Comedy, Fantasy. Streaming providers unkown."
For the Sake of Vicious,722780,"Action, Horror, Mystery","Lora Burke, Nick Smyth, Colin Paradine, T.J. Kennedy, James Fler",Reese Eveneshen,/iqO2sTFqm6XwEXmlLxKDX75RPjY.jpg,2021-04-16,"Movie 'For the Sake of Vicious', directed by Reese Eveneshen, released on 2021-04-16.                         Average rating is 6.429 out of 10, and current popularity is 2.875.                                     Overview: 'An overworked nurse returns home to find a maniac hiding out with a bruised and beaten hostage. When an unexpected wave of violent intruders descend upon her home, it becomes a fight for survival.'                                         Top cast includes: Lora Burke, Nick Smyth, Colin Paradine, T.J. Kennedy, James Fler. Genres: Action, Horror, Mystery.                                            Available on: Amazon Prime Video, AMC+ Amazon Channel, Shudder Amazon Channel, Shudder Apple TV Channel, Amazon Prime Video with Ads."
Rise of the Footsoldier: Origins,854732,"Crime, Drama, Action","Terry Stone, Vinnie Jones, Roland Manookian, George Russo, Craig Fairbrass",Nick Nevern,/gHgr6BIYFXhwyjBugQRiNw2h19h.jpg,2021-09-03,"Movie 'Rise of the Footsoldier: Origins', directed by Nick Nevern, released on 2021-09-03.                         Average rating is 5.8 out of 10, and current popularity is 2.706.                                     Overview: 'A brutal account of how real-life, hard-as-nails Falklands War veteran Tony Tucker came to be involved in one of the most notorious gangland murders in British history.'                                         Top cast includes: Terry Stone, Vinnie Jones, Roland Manookian, George Russo, Craig Fairbrass. Genres: Crime, Drama, Action. Streaming providers unkown."
Chompy & the Girls,671725,"Comedy, Horror, Science Fiction","Christy St. John, Steve Marvel, Julie Dolan, Seneca Paliotta, Hari Williams",Skye Braband,/mEqsGycEVv6kfsIgH8dyQbnCcaw.jpg,2021-09-14,"Movie 'Chompy & the Girls', directed by Skye Braband, released on 2021-09-14.                         Average rating is 5.595 out of 10, and current popularity is 2.401.                                     Overview: 'A troubled woman meets her father for the first time and their encounter goes from awkward to alarming when they witness a man swallow a little girl whole.'                                         Top cast includes: Christy St. John, Steve Marvel, Julie Dolan, Seneca Paliotta, Hari Williams. Genres: Comedy, Horror, Science Fiction. Streaming providers unkown."
Insight,796339,"Action, Science Fiction, Drama","Ken Zheng, Tony Todd, Keith David, Madeline Zima, John Savage",Ken Zheng,/oyD5Fqesaw1h1B6OQEkaAONedj9.jpg,2021-03-12,"Movie 'Insight', directed by Ken Zheng, released on 2021-03-12.                         Average rating is 5.6 out of 10, and current popularity is 2.38.                                     Overview: 'Jian is a counter terrorism agent who blends his skills as a martial artist and clairvoyant to bring the world's most nefarious individuals to justice. This lone wolf is is forced to make an unexpected detour to Los Angeles upon receipt of the devastating news of a cover up surrounding his brother's alleged suicide. With the reluctant help of LAPD detectives, Abby, Carl, and Captain Duke, the unlikely group become involved in the investigation. Jian and Abby fight against a high-tech criminal looking to exploit the brothers' gifts in his own quest to power.'                                         Top cast includes: Ken Zheng, Tony Todd, Keith David, Madeline Zima, John Savage. Genres: Action, Science Fiction, Drama.                                            Available on: Amazon Prime Video, fuboTV, Epix Amazon Channel, Amazon Prime Video with Ads."
Love Gets a Room,875419,"Drama, Romance","Clara Rugaard, Ferdia Walsh-Peelo, Mark Ryder, Valentina Bellè, Jack Roth",Rodrigo Cortés,/bfzXouYUfnIfEK9l7neFV3nFrjz.jpg,2023-06-30,"Movie 'Love Gets a Room', directed by Rodrigo Cortés, released on 2023-06-30.                         Average rating is 7.065 out of 10, and current popularity is 2.372.                                     Overview: 'January 1942, in Nazi-occupied Poland during World War II. Thousands of Jews have been confined to the Warsaw ghetto for more than a year. Outside, life goes on; inside, they struggle to survive another day. Still, on a cold winter night, a group of Jewish actors manage to stage a lively musical comedy.'                                         Top cast includes: Clara Rugaard, Ferdia Walsh-Peelo, Mark Ryder, Valentina Bellè, Jack Roth. Genres: Drama, Romance. Streaming providers unkown."
The Show,567910,"Drama, Fantasy, Mystery","Tom Burke, Siobhan Hewlett, Ellie Bamber, Sheila Atim, Richard Dillane",Mitch Jenkins,/iZJ3IEJ5rvWgxbVbkAF4uU6ZIo.jpg,2021-08-26,"Movie 'The Show', directed by Mitch Jenkins, released on 2021-08-26.                         Average rating is 5.4 out of 10, and current popularity is 2.846.                                     Overview: 'A man goes on a mission to locate a stolen artifact for a client, which leads him to a haunted town full of vampires, sleeping beauties, and Voodoo gangsters.'                                         Top cast includes: Tom Burke, Siobhan Hewlett, Ellie Bamber, Sheila Atim, Richard Dillane. Genres: Drama, Fantasy, Mystery.                                            Available on: Starz Apple TV Channel, Starz Roku Premium Channel, Starz, Starz Amazon Channel."
Marvel's Behind the Mask,787923,Documentary,"Joe Quesada, Peter Sanderson, Sana Amanat, Neal Kirby, Reginald Hudlin",Mike Jacobs,/p71YgDQk5sFHTqF3FBygLPmZEX5.jpg,2021-02-12,"Movie 'Marvel's Behind the Mask', directed by Mike Jacobs, released on 2021-02-12.                         Average rating is 7.1 out of 10, and current popularity is 5.169.                                     Overview: 'A documentary special that explores the power of identity behind the iconic superheroes we know and love today. These legendary Marvel creations and stories have not only reflected the world outside our window – they have become a reflection of our own identities and who we truly are.'                                         Top cast includes: Joe Quesada, Peter Sanderson, Sana Amanat, Neal Kirby, Reginald Hudlin. Genres: Documentary.                                            Available on: Disney Plus."
Easter Bunny Massacre,922607,"Mystery, Horror","Sarah T. Cohen, Sarah Alexandra Marks, May Kelly, Beatrice Fletcher, Antonia Whillans",Jack Peter Mundy,/2g2IqiEKJ0C3DGyB1Jy7NAdR57Z.jpg,2021-10-11,"Movie 'Easter Bunny Massacre', directed by Jack Peter Mundy, released on 2021-10-11.                         Average rating is 5.1 out of 10, and current popularity is 2.451.                                     Overview: 'A group of friends hiding a deadly secret are hunted down one by one by a bunny masked killer.'                                         Top cast includes: Sarah T. Cohen, Sarah Alexandra Marks, May Kelly, Beatrice Fletcher, Antonia Whillans. Genres: Mystery, Horror.                                            Available on: Amazon Prime Video, Peacock Premium, Amazon Prime Video with Ads, Peacock Premium Plus."
We Need to Do Something,769364,"Horror, Mystery","Sierra McCormick, Vinessa Shaw, Pat Healy, John James Cronin, Lisette Olivera",Sean King O'Grady,/g0qiyVdMRaEdXfdR10TVveDProY.jpg,2021-09-03,"Movie 'We Need to Do Something', directed by Sean King O'Grady, released on 2021-09-03.                         Average rating is 5.341 out of 10, and current popularity is 5.407.                                     Overview: 'Seeking shelter from a storm, a family finds themselves trapped in a bathroom for days with no sign of rescue and untold evils lurking just beyond the walls.'                                         Top cast includes: Sierra McCormick, Vinessa Shaw, Pat Healy, John James Cronin, Lisette Olivera. Genres: Horror, Mystery.                                            Available on: Hulu."
Boxing Day,768232,"Romance, Comedy","Aml Ameen, Aja Naomi King, Leigh-Anne, Marianne Jean-Baptiste, Tamara Lawrance",Aml Ameen,/4Mi0iEcN6qKXnZiDLe5G4JNQZLV.jpg,2021-12-17,"Movie 'Boxing Day', directed by Aml Ameen, released on 2021-12-17.                         Average rating is 6.9 out of 10, and current popularity is 5.157.                                     Overview: 'Melvin, a British author living in America, returns home to London for Christmas to introduce his American fiancée Lisa to his eccentric British-Caribbean family. Their relationship is put to the test as she discovers the world her fiancé has left behind.'                                         Top cast includes: Aml Ameen, Aja Naomi King, Leigh-Anne, Marianne Jean-Baptiste, Tamara Lawrance. Genres: Romance, Comedy.                                            Available on: Amazon Prime Video, Amazon Prime Video with Ads."
Jingle Bell Princess,874257,"TV Movie, Comedy, Drama, Romance","Trevor Donovan, Merritt Patterson, Charlie Boyle, Marnie McPhail, Matthew Finlan",Don McBrearty,/jqxh21dySEujfIvxQaIV3ti6oj5.jpg,2021-12-04,"Movie 'Jingle Bell Princess', directed by Don McBrearty, released on 2021-12-04.                         Average rating is 6.636 out of 10, and current popularity is 3.833.                                     Overview: 'An actual princess has some mechanical issues and is temporarily grounded.  Does she have time for a lobster roll? It is Christmas time in Maine which means snow, quaint scenery, and lots of Christmas lights near the ocean.  With the crew distracted attending to the repair, Princess Amelia deplanes to walk through a magical Christmas tree lot near the airport perimeter.'                                         Top cast includes: Trevor Donovan, Merritt Patterson, Charlie Boyle, Marnie McPhail, Matthew Finlan. Genres: TV Movie, Comedy, Drama, Romance. Streaming providers unkown."
The Great and Terrible Day of the Lord,920429,"Drama, Horror, Thriller","Jordan Ashley Grier, Swayde McCoy",Clark Runciman,/6EyEGGhkaDZLCjxRIRoeUm248G8.jpg,2021-12-28,"Movie 'The Great and Terrible Day of the Lord', directed by Clark Runciman, released on 2021-12-28.                         Average rating is 6.694 out of 10, and current popularity is 2.421.                                     Overview: 'On Michael and Gabby's first romantic get-away things takes a terrifying turn when God delivers unsettling news to Gabby after taking over Michael's body. Is Michael a manipulative psychopath or could this really be a direct experience with her creator offering a path to eternal happiness?'                                         Top cast includes: Jordan Ashley Grier, Swayde McCoy. Genres: Drama, Horror, Thriller.                                            Available on: fuboTV."
