title,id,genres,cast,director,poster_path,release_date,semantic_field
The Velvet Underground,543836,"Documentary, Music","Lou Reed, John Cale, Sterling Morrison, Maureen Tucker, Jonas Mekas",Todd Haynes,/9uRF6vERWfhlSZKc1sAJTTdG2Ix.jpg,2021-10-15,"Movie 'The Velvet Underground', directed by Todd Haynes, released on 2021-10-15.                         Average rating is 6.832 out of 10, and current popularity is 11.116.                                     Overview: 'Experience the iconic rock band's legacy in the first major documentary to tell their story. Directed with the era’s avant-garde spirit by Todd Haynes, this kaleidoscopic oral history combines exclusive interviews with dazzling archival footage.'                                         Top cast includes: Lou Reed, John Cale, Sterling Morrison, Maureen Tucker, Jonas Mekas. Genres: Documentary, Music.                                            Available on: Apple TV Plus."
The Devil Below,760875,"Horror, Thriller","Alicia Sanz, Adan Canto, Will Patton, Zach Avery, Chinaza Uche",Bradley Parker,/bKpkB86oJ2IyIlpGLTF66zBPSDp.jpg,2021-03-05,"Movie 'The Devil Below', directed by Bradley Parker, released on 2021-03-05.                         Average rating is 4.609 out of 10, and current popularity is 7.454.                                     Overview: 'A group of four amateur adventurers who specialize in exploring remote and forsaken places pay a visit to Shookum Hills, a town in the remote Appalachian Mountains which was abandoned decades ago due to a mysterious coal mine fire.'                                         Top cast includes: Alicia Sanz, Adan Canto, Will Patton, Zach Avery, Chinaza Uche. Genres: Horror, Thriller.                                            Available on: Amazon Prime Video, Amazon Prime Video with Ads."
Long Weekend,635012,"Romance, Comedy","Finn Wittrock, Zoë Chao, Damon Wayans Jr., Casey Wilson, Jim Rash",Stephen Basilone,/OyKfblQX6SR2rL6R26g5eYCLHq.jpg,2021-03-12,"Movie 'Long Weekend', directed by Stephen Basilone, released on 2021-03-12.                         Average rating is 7.152 out of 10, and current popularity is 5.761.                                     Overview: 'Bart's chance encounter with the enigmatic Vienna leads to a whirlwind weekend together. The two fall fast and hard, but both carry secrets that could be their undoing or the chance for a fresh start.'                                         Top cast includes: Finn Wittrock, Zoë Chao, Damon Wayans Jr., Casey Wilson, Jim Rash. Genres: Romance, Comedy.                                            Available on: Starz Apple TV Channel, Starz Roku Premium Channel, Starz, Starz Amazon Channel."
Downeast,802194,"Drama, Crime, Thriller","Greg Finley, Dylan Silver, Judson Mills, Joss Glennie-Smith, Gareth Williams",Joe Raffa,/s2JZkkFnIZjXfEztl5CBr6Hjr6Z.jpg,2021-03-31,"Movie 'Downeast', directed by Joe Raffa, released on 2021-03-31.                         Average rating is 6.955 out of 10, and current popularity is 7.348.                                     Overview: 'Dives into the often ignored seedy underbelly of Maine and it follows Emma Maddox as she returns to her hometown years following the mysterious death of her brother, Mikey. As she reconnects with his best friend Tommy, the two rekindle their flame and Emma begins to uncover the web of lies the town has been keeping.'                                         Top cast includes: Greg Finley, Dylan Silver, Judson Mills, Joss Glennie-Smith, Gareth Williams. Genres: Drama, Crime, Thriller.                                            Available on: fuboTV, Paramount Plus, Paramount Plus Apple TV Channel , Paramount+ Amazon Channel."
The Alpinist,682587,Documentary,"Marc-André Leclerc, Brette Harrington, Alex Honnold, Reinhold Messner, Ueli Steck",Nick Rosen,/tYbSGAVbyACEExptLu63CxCGm4O.jpg,2021-09-07,"Movie 'The Alpinist', directed by Nick Rosen, released on 2021-09-07.                         Average rating is 7.607 out of 10, and current popularity is 6.438.                                     Overview: 'Marc-André Leclerc, an exceptional climber, has made solo his religion and ice his homeland. When filmmaker Peter Mortimer begins his film, he places his camera at the base of a British Columbia cliff and waits patiently for the star climber to come down to answer his questions. Marc André, a little uncomfortable, prefers to return to the depths of the forest where he lives in a tent with his girlfriend Brette Harrington. In the heart of winter, Peter films vertiginous solos on fragile ice. He tries to make appointments with the climber who is never there and does not seem really concerned by this camera pointed at him ""For me, it would not be a solo if there was someone else"" . Marc-André is thus, the ""pure light"" of the mountaineers of his time, which marvel Barry Blanchard, Alex Honnold or Reinhold Messner, interviewed in the film. An event film for an extraordinary character.'                                         Top cast includes: Marc-André Leclerc, Brette Harrington, Alex Honnold, Reinhold Messner, Ueli Steck. Genres: Documentary.                                            Available on: fuboTV, Peacock Premium, NBC, USA Network, Peacock Premium Plus."
Blush,818350,"Animation, Romance, Science Fiction, Family",,Joseph Mateo,/xRUTWExrqX40qUr5vZRR0MGAc7i.jpg,2021-06-13,"Movie 'Blush', directed by Joseph Mateo, released on 2021-06-13.                         Average rating is 7.829 out of 10, and current popularity is 8.437.                                     Overview: 'When a horticulturalist-astronaut crashes onto a desolate planet, he encounters an ethereal visitor and discovers the joy of building a new life—realizing the universe has delivered something astonishing.'                                         Top cast includes: . Genres: Animation, Romance, Science Fiction, Family.                                            Available on: Apple TV Plus."
Rise of the Mummy,791910,"Horror, Science Fiction","Abi Casson Thompson, Arthur Boan, Amanda-Jade Tyler, Stephanie Lodge, Megan Purvis",Antonia Johnstone,/tmghT8HaddVIS9hEXIOI9GuDchi.jpg,2021-04-03,"Movie 'Rise of the Mummy', directed by Antonia Johnstone, released on 2021-04-03.                         Average rating is 5.5 out of 10, and current popularity is 10.933.                                     Overview: 'A group of archaeology students awaken an ancient mummy. After being trapped in a time loop, the only way they can escape, is to defeat the mummy. As the body count rises, it seems the Mummy has to collect the souls of those who woke him to be able to walk the earth - for good.'                                         Top cast includes: Abi Casson Thompson, Arthur Boan, Amanda-Jade Tyler, Stephanie Lodge, Megan Purvis. Genres: Horror, Science Fiction.                                            Available on: Amazon Prime Video, Amazon Prime Video with Ads."
False Positive,591634,"Horror, Mystery, Thriller","Ilana Glazer, Justin Theroux, Pierce Brosnan, Zainab Jah, Gretchen Mol",John Lee,/3HSov8EW2fI3oQbUJxOvnf684ej.jpg,2021-06-18,"Movie 'False Positive', directed by John Lee, released on 2021-06-18.                         Average rating is 5.688 out of 10, and current popularity is 6.935.                                     Overview: 'After months of trying and failing to get pregnant, Lucy and Adrian finally find their dream fertility doctor in the illustrious Dr. Hindle. But after becoming pregnant with a healthy baby girl, Lucy begins to notice something sinister through Hindle's gleaming charm, and she sets out to uncover the unsettling truth about him.'                                         Top cast includes: Ilana Glazer, Justin Theroux, Pierce Brosnan, Zainab Jah, Gretchen Mol. Genres: Horror, Mystery, Thriller.                                            Available on: Hulu."
Vicious Fun,728054,"Comedy, Horror, Romance","Evan Marsh, Amber Goldfarb, Ari Millen, Julian Richings, Robert Maillet",Cody Calahan,/jCz4Pv0rilnkBgqwbe5Y3JT5899.jpg,2021-06-29,"Movie 'Vicious Fun', directed by Cody Calahan, released on 2021-06-29.                         Average rating is 6.5 out of 10, and current popularity is 7.132.                                     Overview: 'Joel, a caustic 1980s film critic for a national horror magazine, finds himself unwittingly trapped in a self-help group for serial killers. With no other choice, Joel attempts to blend in with his homicidal surroundings or risk becoming the next victim.'                                         Top cast includes: Evan Marsh, Amber Goldfarb, Ari Millen, Julian Richings, Robert Maillet. Genres: Comedy, Horror, Romance.                                            Available on: AMC+ Amazon Channel, AMC+, Shudder, Shudder Amazon Channel, Shudder Apple TV Channel."
A House on the Bayou,808090,"Horror, Mystery, Thriller","Paul Schneider, Angela Sarafyan, Lia McHugh, Jacob Lofland, Doug Van Liew",Alex McAulay,/3qCUy997QKgZDieby5sF6mMHAsB.jpg,2021-11-19,"Movie 'A House on the Bayou', directed by Alex McAulay, released on 2021-11-19.                         Average rating is 5.711 out of 10, and current popularity is 8.432.                                     Overview: 'In an effort to reconnect and mend their relationship, a troubled couple and their preteen daughter seek an idyllic getaway to a remote mansion in rural Louisiana. But when unexpected visitors arrive, their facade of family unity starts to unravel, as terrifying secrets come to light.'                                         Top cast includes: Paul Schneider, Angela Sarafyan, Lia McHugh, Jacob Lofland, Doug Van Liew. Genres: Horror, Mystery, Thriller.                                            Available on: Amazon Prime Video, fuboTV, Epix Amazon Channel, MGM Plus Roku Premium Channel, MGM Plus, Amazon Prime Video with Ads."
Last Shoot Out,887767,"Western, Action, Thriller, Drama","Jay Pickett, Michael Welch, Skylar Witte, Cam Gigandet, Bruce Dern",Michael Feifer,/pvEtPxotI3POlVPvNxgrHJuDXfe.jpg,2021-12-03,"Movie 'Last Shoot Out', directed by Michael Feifer, released on 2021-12-03.                         Average rating is 6.4 out of 10, and current popularity is 8.176.                                     Overview: 'Soon after a newlywed learns that her husband had her father shot down, she flees from the Callahan ranch in fear. She's rescued by a gunman who safeguards her at a remote outpost as he staves off her husband's attempts to reclaim his bride.'                                         Top cast includes: Jay Pickett, Michael Welch, Skylar Witte, Cam Gigandet, Bruce Dern. Genres: Western, Action, Thriller, Drama.                                            Available on: fuboTV, Paramount+ with Showtime, Paramount Plus Apple TV Channel , Paramount+ Amazon Channel."
Everybody's Talking About Jamie,624899,"Drama, Comedy","Max Harwood, Sarah Lancashire, Lauren Patel, Sharon Horgan, Richard E. Grant",Jonathan Butterell,/wsCHo64bJ8lMhKv8LtOKEn1kjsH.jpg,2021-06-12,"Movie 'Everybody's Talking About Jamie', directed by Jonathan Butterell, released on 2021-06-12.                         Average rating is 6.122 out of 10, and current popularity is 6.669.                                     Overview: 'Jamie New is 16 and doesn’t quite fit in—instead of pursuing a ""real"" career he dreams of becoming a drag queen. Uncertain about his future, Jamie knows one thing for sure: he is going to be a sensation. Supported by his loving mom and his amazing friends, Jamie overcomes prejudice, beats the bullies and steps out of the darkness, into the spotlight.'                                         Top cast includes: Max Harwood, Sarah Lancashire, Lauren Patel, Sharon Horgan, Richard E. Grant. Genres: Drama, Comedy.                                            Available on: Amazon Prime Video, Amazon Prime Video with Ads."
Infinitum: Subject Unknown,797861,"Science Fiction, Thriller, Mystery","Tori Butler-Hart, Ian McKellen, Conleth Hill, Wendy Muir Hart, Christopher Hart",Matthew Butler-Hart,/qrcqNcct1Y2bAUoVDQalMQZg29o.jpg,2021-08-06,"Movie 'Infinitum: Subject Unknown', directed by Matthew Butler-Hart, released on 2021-08-06.                         Average rating is 5.4 out of 10, and current popularity is 5.789.                                     Overview: 'Jane is the subject of a twisted science experiment where she is placed in a parallel world and is forced to find a way to either alter her reality or be stuck in a time-loop, destined to repeat the same test over and over again, with no memory of her doing it before. But with each 'reset' she starts to retain fragments of memory. With clues pointing to the mysterious Wytness Quantum Research Centre, she tries to find a way out.  (The film was shot entirely on an iPhone during the UK’s first lockdown.)'                                         Top cast includes: Tori Butler-Hart, Ian McKellen, Conleth Hill, Wendy Muir Hart, Christopher Hart. Genres: Science Fiction, Thriller, Mystery.                                            Available on: Amazon Prime Video, fuboTV, Epix Amazon Channel, MGM Plus, Amazon Prime Video with Ads."
An Audience with Adele,901047,"Music, Documentary","Adele, Alan Carr, Emma Thompson, Samuel L. Jackson, Idris Elba",Liz Clare,/zctubRROrjE9HcsZ8FBCYBnmCvc.jpg,2021-11-21,"Movie 'An Audience with Adele', directed by Liz Clare, released on 2021-11-21.                         Average rating is 8.295 out of 10, and current popularity is 4.57.                                     Overview: 'Joining multi-Grammy Award winning and one of the biggest UK artists of all time, Adele, for a unique and special night at the legendary London Palladium, where she performs her chart-topping single Easy On Me, as well as tracks from her new album, 30.'                                         Top cast includes: Adele, Alan Carr, Emma Thompson, Samuel L. Jackson, Idris Elba. Genres: Music, Documentary. Streaming providers unkown."
Ben Gen 10,828397,Animation,"Tara Strong, Montserrat Hernandez, David Kaye, Travis Willingham, Daryl Sabara",Henrique Jardim,/nxWAw5kaYjSH8EIcUz6VtHj8jyd.jpg,2021-04-10,"Movie 'Ben Gen 10', directed by Henrique Jardim, released on 2021-04-10.                         Average rating is 6.1 out of 10, and current popularity is 7.402.                                     Overview: 'When Ben meets a young Generator Rex on the run from a hostile Providence, he must work through a series of misunderstandings, and defeat the dark wizard Hex in order to save the world.'                                         Top cast includes: Tara Strong, Montserrat Hernandez, David Kaye, Travis Willingham, Daryl Sabara. Genres: Animation. Streaming providers unkown."
Small Engine Repair,665896,"Crime, Drama, Thriller","Jon Bernthal, Shea Whigham, Jordana Spiro, John Pollono, Ciara Bravo",John Pollono,/8xYm5fZXT0DNuGRUHdkQJ1puNYH.jpg,2021-09-10,"Movie 'Small Engine Repair', directed by John Pollono, released on 2021-09-10.                         Average rating is 6.154 out of 10, and current popularity is 7.188.                                     Overview: 'The seemingly casual reunion of three old friends at an out-of-the-way repair shop masks a hidden agenda fuelled by the arrival of a privileged young yuppie.'                                         Top cast includes: Jon Bernthal, Shea Whigham, Jordana Spiro, John Pollono, Ciara Bravo. Genres: Crime, Drama, Thriller.                                            Available on: Hulu."
Found,819500,Documentary,,Amanda Lipitz,/9yUFnLw5KkcinnWUzGx8Fll28BN.jpg,2021-10-13,"Movie 'Found', directed by Amanda Lipitz, released on 2021-10-13.                         Average rating is 7.417 out of 10, and current popularity is 7.449.                                     Overview: 'Follows the story of three American teenage girls—each adopted from China—who discover they are blood-related cousins on 23andMe. Their online meeting inspires the young women to confront the burning questions they have about their lost history.'                                         Top cast includes: . Genres: Documentary.                                            Available on: Netflix, Netflix basic with Ads."
The Year Earth Changed,811703,Documentary,"David Attenborough, Bhashkar Bara, Dulu Bora, Anshul Chopra, Christine Gabriele",Tom Beard,/cLwQRXfzPjmpU6I78TCkoHazO0A.jpg,2021-04-15,"Movie 'The Year Earth Changed', directed by Tom Beard, released on 2021-04-15.                         Average rating is 8.0 out of 10, and current popularity is 7.525.                                     Overview: 'Never-before-seen footage shows how our living in lockdown opened the door for nature to bounce back and thrive. Across the seas, skies, and lands, Earth found its rhythm when we came to a stop.'                                         Top cast includes: David Attenborough, Bhashkar Bara, Dulu Bora, Anshul Chopra, Christine Gabriele. Genres: Documentary.                                            Available on: Apple TV Plus."
Hellbender,848886,Horror,"Zelda Adams, Toby Poser, Lulu Adams, John Adams, Rinzin Thonden",Zelda Adams,/uLDYfeJ9BvrQsC3MBqMUjG4Hgaz.jpg,2021-09-28,"Movie 'Hellbender', directed by Zelda Adams, released on 2021-09-28.                         Average rating is 5.425 out of 10, and current popularity is 8.397.                                     Overview: 'A teen and her mother live simply in a home in the woods, spending their time making metal music. A chance encounter with a fellow teen causes her to uncover a connection between her family and witchcraft, which causes a rift with her mother.'                                         Top cast includes: Zelda Adams, Toby Poser, Lulu Adams, John Adams, Rinzin Thonden. Genres: Horror.                                            Available on: AMC+ Amazon Channel, AMC+, Shudder, Shudder Amazon Channel, Shudder Apple TV Channel."
Aquarium of the Dead,809929,"Horror, Action, Comedy","Vivica A. Fox, Eva Ceja, D. C. Douglas, Erica Duke, Anthony Jensen",Glenn Miller,/6EukULuv5FVCTGpGfC6LZBV4dsc.jpg,2021-05-21,"Movie 'Aquarium of the Dead', directed by Glenn Miller, released on 2021-05-21.                         Average rating is 5.257 out of 10, and current popularity is 4.745.                                     Overview: 'A scientific mishap causes the species of an aquarium to become zombies.'                                         Top cast includes: Vivica A. Fox, Eva Ceja, D. C. Douglas, Erica Duke, Anthony Jensen. Genres: Horror, Action, Comedy. Streaming providers unkown."
"Who Are You, Charlie Brown?",836919,"Documentary, Animation","Lupita Nyong'o, Tyler James Nathan, Terry McGurrin, Isabella Leo, Holly Gorski",Michael Bonfiglio,/cMC5pAZIwkYQRuhnhf2Bw0kE1I6.jpg,2021-06-25,"Movie 'Who Are You, Charlie Brown?', directed by Michael Bonfiglio, released on 2021-06-25.                         Average rating is 7.088 out of 10, and current popularity is 7.662.                                     Overview: 'A documentary about Peanuts and its creator, Charles M. Schulz. Famous fans—including Drew Barrymore, Kevin Smith, and Al Roker—share its influence on them, and a new animated story finds Charlie Brown on a quest.'                                         Top cast includes: Lupita Nyong'o, Tyler James Nathan, Terry McGurrin, Isabella Leo, Holly Gorski. Genres: Documentary, Animation.                                            Available on: Apple TV Plus."
Father Christmas Is Back,762469,"Comedy, Family","Nathalie Cox, Talulah Riley, Elizabeth Hurley, Kelsey Grammer, John Cleese",Philippe Martinez,/mI6mFCO3lrJ4ovzwfmoLs58uhlK.jpg,2021-11-07,"Movie 'Father Christmas Is Back', directed by Philippe Martinez, released on 2021-11-07.                         Average rating is 4.649 out of 10, and current popularity is 10.517.                                     Overview: 'Four sisters – Caroline, Joanna, Paulina, and Vicky – reunite for the Christmas Holiday in a Yorkshire mansion. However, their estranged father, James, joins in for the first time since he left the family behind decades prior. The group attempts to get through the holiday despite comedic misunderstandings, while also uncovering the long-buried secret that tore their family apart, so many years ago.'                                         Top cast includes: Nathalie Cox, Talulah Riley, Elizabeth Hurley, Kelsey Grammer, John Cleese. Genres: Comedy, Family.                                            Available on: Netflix, Netflix basic with Ads."
Good on Paper,823461,"Comedy, Romance","Iliza Shlesinger, Ryan Hansen, Margaret Cho, Rebecca Rittenhouse, Matt McGorry",Kimmy Gatewood,/hkU2FQNWUEQFgLrDGrpZQ7Y17zx.jpg,2021-06-23,"Movie 'Good on Paper', directed by Kimmy Gatewood, released on 2021-06-23.                         Average rating is 5.565 out of 10, and current popularity is 5.89.                                     Overview: 'After years of putting her career ahead of love, stand-up comic Andrea Singer has stumbled upon the perfect guy. On paper, he checks all the boxes but is he everything he appears to be?'                                         Top cast includes: Iliza Shlesinger, Ryan Hansen, Margaret Cho, Rebecca Rittenhouse, Matt McGorry. Genres: Comedy, Romance.                                            Available on: Netflix, Netflix basic with Ads."
"Ben 10: Ben 10,010",834802,"Animation, Action","Tara Strong, Montse Hernandez, David Kaye, Greg Cipes, John DiMaggio",Henrique Jardim,/6aDh4yH5FHaMfjdsqw4n97rl7FJ.jpg,2021-04-09,"Movie 'Ben 10: Ben 10,010', directed by Henrique Jardim, released on 2021-04-09.                         Average rating is 6.2 out of 10, and current popularity is 10.377.                                     Overview: 'In a future where an adult Gwen Tennyson is president and the world is being taken over by the alien horde known as the Xerge, a disillusioned Ben 10,000 is called out of retirement to recruit his 10-year-old version from the past. Based on the 2016 reboot.'                                         Top cast includes: Tara Strong, Montse Hernandez, David Kaye, Greg Cipes, John DiMaggio. Genres: Animation, Action. Streaming providers unkown."
The Killing of Two Lovers,653712,"Drama, Thriller","Clayne Crawford, Sepideh Moafi, Chris Coy, Avery Pizzuto, Arri Graham",Robert Machoian,/1Y3EmEl00UjmFvu2jP67JK0At2S.jpg,2021-02-23,"Movie 'The Killing of Two Lovers', directed by Robert Machoian, released on 2021-02-23.                         Average rating is 6.4 out of 10, and current popularity is 6.121.                                     Overview: 'David desperately tries to keep his family of six together during a separation from his wife. They both agree to see other people but David struggles to grapple with his wife’s new relationship.'                                         Top cast includes: Clayne Crawford, Sepideh Moafi, Chris Coy, Avery Pizzuto, Arri Graham. Genres: Drama, Thriller. Streaming providers unkown."
A Journal for Jordan,501841,"Drama, Romance","Michael B. Jordan, Chanté Adams, Jalon Christian, Robert Wisdom, Tamara Tunie",Denzel Washington,/t8xX6kYZj6y0XIxniJdFmaFkvp1.jpg,2021-12-25,"Movie 'A Journal for Jordan', directed by Denzel Washington, released on 2021-12-25.                         Average rating is 7.0 out of 10, and current popularity is 7.134.                                     Overview: 'Based on the true story of First Sergeant Charles Monroe King, a soldier deployed to Iraq begins to keep a journal of love and advice for his infant son. Back at home, senior New York Times editor Dana Canedy revisits the story of her unlikely, life-altering relationship with King and his enduring devotion to her and their child.'                                         Top cast includes: Michael B. Jordan, Chanté Adams, Jalon Christian, Robert Wisdom, Tamara Tunie. Genres: Drama, Romance.                                            Available on: fuboTV."
The Retreat,821390,"Thriller, Horror","Tommie-Amber Pirie, Sarah Allen, Rossif Sutherland, Aaron Ashmore, Celina Sinden",Pat Mills,/xDlc336bLsy9dgkvuGEm0bGz6Mb.jpg,2021-05-21,"Movie 'The Retreat', directed by Pat Mills, released on 2021-05-21.                         Average rating is 5.06 out of 10, and current popularity is 5.855.                                     Overview: 'Renee and Valerie, a couple at a cross roads in their relationship, leave the city to spend the week at a remote cabin with friends. But when they arrive, their friends are nowhere to be found. As they stumble through their relationship woes, they discover they are being hunted by a group of militant extremists who are determined to exterminate them.'                                         Top cast includes: Tommie-Amber Pirie, Sarah Allen, Rossif Sutherland, Aaron Ashmore, Celina Sinden. Genres: Thriller, Horror. Streaming providers unkown."
Trippin’ with the Kandasamys,834500,"Comedy, Romance","Jailoshini Naidoo, Koobeshan Naidoo, Maeshni Naicker, Mishqah Parthiephal, Mariam Bassa",Jayan Moodley,/89xDX9eYSaqCPD4RNqXYzuRhqW3.jpg,2021-06-04,"Movie 'Trippin’ with the Kandasamys', directed by Jayan Moodley, released on 2021-06-04.                         Average rating is 6.8 out of 10, and current popularity is 4.938.                                     Overview: 'To rekindle their marriages, best friends-turned-in-laws Shanthi and Jennifer plan a couples' getaway. But it comes with all kinds of surprises.'                                         Top cast includes: Jailoshini Naidoo, Koobeshan Naidoo, Maeshni Naicker, Mishqah Parthiephal, Mariam Bassa. Genres: Comedy, Romance.                                            Available on: Netflix, Netflix basic with Ads."
