title,id,genres,cast,director,poster_path,release_date,semantic_field
Snoopy Presents: For Auld Lang Syne,881211,"Animation, Family, Comedy","Etienne Kellici, Isabella Leo, Wyatt White, Terry McGurrin, Rob Tinkler",Clay Kaytis,/p0ONYt2cw0vPEnZIoOHq1Ki7Ifm.jpg,2021-12-09,"Movie 'Snoopy Presents: For Auld Lang Syne', directed by Clay Kaytis, released on 2021-12-09.                         Average rating is 7.2 out of 10, and current popularity is 12.14.                                     Overview: 'After finding out her grandmother won't be visiting for Christmas, Lucy decides to cheer herself up by throwing the ultimate New Year's Eve party. Meanwhile, Charlie Brown tries to fulfill one of his resolutions before the clock strikes midnight.'                                         Top cast includes: Etienne Kellici, Isabella Leo, Wyatt White, Terry McGurrin, Rob Tinkler. Genres: Animation, Family, Comedy.                                            Available on: Apple TV Plus."
Things Heard & Seen,631060,Horror,"Amanda Seyfried, James Norton, Natalia Dyer, Alex Neustaedter, Rhea Seehorn",Robert Pulcini,/9tSkNmGt1K5Lgf0L0BTHHYJNz0W.jpg,2021-04-29,"Movie 'Things Heard & Seen', directed by Robert Pulcini, released on 2021-04-29.                         Average rating is 5.7 out of 10, and current popularity is 16.152.                                     Overview: 'Catherine Clare reluctantly trades life in 1980 Manhattan for a remote home in the tiny hamlet of Chosen, New York, after her husband George lands a job teaching art history at a small Hudson Valley college. Even as she does her best to transform the old dairy farm into a place where young daughter Franny will be happy, Catherine increasingly finds herself isolated and alone. She soon comes to sense a sinister darkness lurking both in the walls of the ramshackle property—and in her marriage to George.'                                         Top cast includes: Amanda Seyfried, James Norton, Natalia Dyer, Alex Neustaedter, Rhea Seehorn. Genres: Horror.                                            Available on: Netflix, Netflix basic with Ads."
Great White,534072,"Horror, Thriller","Katrina Bowden, Te Kohe Tuhaka, Aaron Jakubenko, Kimie Tsukakoshi, Tatjana Marjanovic",Martin Wilson,/2wEVked59Y00NKK4Vj0FgzUzdPH.jpg,2021-07-16,"Movie 'Great White', directed by Martin Wilson, released on 2021-07-16.                         Average rating is 5.241 out of 10, and current popularity is 19.887.                                     Overview: 'A sea plane is destroyed in a freak accident, five people find themselves drifting on a raft. At the mercy of the tide and with no hope of rescue, the helpless situation takes a horrifying turn when they are terrorized by a ravenous great white.'                                         Top cast includes: Katrina Bowden, Te Kohe Tuhaka, Aaron Jakubenko, Kimie Tsukakoshi, Tatjana Marjanovic. Genres: Horror, Thriller.                                            Available on: AMC+ Amazon Channel, Shudder, Shudder Amazon Channel, Shudder Apple TV Channel."
The Map of Tiny Perfect Things,672647,"Fantasy, Romance","Kyle Allen, Kathryn Newton, Jermaine Harris, Anna Mikami, Josh Hamilton",Ian Samuels,/6y3ev0rJFbHA1hU22UPmmfzBjrG.jpg,2021-02-12,"Movie 'The Map of Tiny Perfect Things', directed by Ian Samuels, released on 2021-02-12.                         Average rating is 7.112 out of 10, and current popularity is 14.642.                                     Overview: 'Two teenagers trapped in an endless time loop set out to find all the tiny things that make that one day perfect.'                                         Top cast includes: Kyle Allen, Kathryn Newton, Jermaine Harris, Anna Mikami, Josh Hamilton. Genres: Fantasy, Romance.                                            Available on: Amazon Prime Video, Amazon Prime Video with Ads."
The Card Counter,643532,"Drama, Thriller","Oscar Isaac, Tiffany Haddish, Tye Sheridan, Willem Dafoe, Alexander Babara",Paul Schrader,/y5DNLVg0gPiGSkuK4yFc4fjQ42Q.jpg,2021-09-10,"Movie 'The Card Counter', directed by Paul Schrader, released on 2021-09-10.                         Average rating is 6.131 out of 10, and current popularity is 13.144.                                     Overview: 'William Tell just wants to play cards. His spartan existence on the casino trail is shattered when he is approached by Cirk, a vulnerable and angry young man seeking help to execute his plan for revenge on a military colonel. Tell sees a chance at redemption through his relationship with Cirk. But keeping Cirk on the straight-and-narrow proves impossible, dragging Tell back into the darkness of his past.'                                         Top cast includes: Oscar Isaac, Tiffany Haddish, Tye Sheridan, Willem Dafoe, Alexander Babara. Genres: Drama, Thriller.                                            Available on: fuboTV, Peacock Premium, NBC, USA Network, Peacock Premium Plus."
American Underdog,673309,"Drama, Family","Zachary Levi, Anna Paquin, Hayden Zaller, Ser'Darius Blain, Dennis Quaid",Andrew Erwin,/bzWkU9E1wUEywduYg3cX6iXGMk9.jpg,2021-12-25,"Movie 'American Underdog', directed by Andrew Erwin, released on 2021-12-25.                         Average rating is 7.139 out of 10, and current popularity is 12.391.                                     Overview: 'The true story of Kurt Warner, who went from a stockboy at a grocery store to a two-time NFL MVP, Super Bowl champion, and Hall of Fame quarterback.'                                         Top cast includes: Zachary Levi, Anna Paquin, Hayden Zaller, Ser'Darius Blain, Dennis Quaid. Genres: Drama, Family.                                            Available on: fuboTV."
22 vs. Earth,811367,"Family, Comedy, Fantasy, Animation","Tina Fey, Alice Braga, Richard Ayoade, Micah Chen, Adela Drabek",Kevin Nolting,/32vLDKSzcCMh55zqqaSqqUA8naz.jpg,2021-04-30,"Movie '22 vs. Earth', directed by Kevin Nolting, released on 2021-04-30.                         Average rating is 7.025 out of 10, and current popularity is 15.367.                                     Overview: 'Set before the events of ‘Soul’, 22 refuses to go to Earth, enlisting a gang of 5 new souls in attempt of rebellion. However, 22’s subversive plot leads to a surprising revelation about the meaning of life.'                                         Top cast includes: Tina Fey, Alice Braga, Richard Ayoade, Micah Chen, Adela Drabek. Genres: Family, Comedy, Fantasy, Animation.                                            Available on: Disney Plus."
Firebird,797838,"Drama, Romance, War","Tom Prior, Oleg Zagorodnii, Diana Pozharskaya, Jake Henderson, Margus Prangel",Peeter Rebane,/uECWNRjCEwewHBjt0leyZiAyiXb.jpg,2022-04-29,"Movie 'Firebird', directed by Peeter Rebane, released on 2022-04-29.                         Average rating is 7.199 out of 10, and current popularity is 13.37.                                     Overview: 'At the height of the Cold War, a troubled soldier forms a forbidden love triangle with a daring fighter pilot and his female comrade amid the dangerous surroundings of a Soviet Air Force Base.'                                         Top cast includes: Tom Prior, Oleg Zagorodnii, Diana Pozharskaya, Jake Henderson, Margus Prangel. Genres: Drama, Romance, War.                                            Available on: Amazon Prime Video, Amazon Prime Video with Ads."
West Side Story,511809,"Drama, Romance, Crime","Ansel Elgort, Rachel Zegler, Ariana DeBose, David Alvarez, Mike Faist",Steven Spielberg,/myAX5qoD6YVLNGiWpk2wcU66Vfq.jpg,2021-12-10,"Movie 'West Side Story', directed by Steven Spielberg, released on 2021-12-10.                         Average rating is 7.001 out of 10, and current popularity is 14.369.                                     Overview: 'Two youngsters from rival New York City gangs fall in love, but tensions between their respective friends build toward tragedy.'                                         Top cast includes: Ansel Elgort, Rachel Zegler, Ariana DeBose, David Alvarez, Mike Faist. Genres: Drama, Romance, Crime.                                            Available on: Disney Plus, fuboTV."
Monster Family 2,823609,"Animation, Family, Comedy","Emily Watson, Nick Frost, Jessica Brown Findlay, Ethan Rouse, Jason Isaacs",Holger Tappe,/fD3w59S1e3otqTMQDzxLq24khUf.jpg,2021-10-15,"Movie 'Monster Family 2', directed by Holger Tappe, released on 2021-10-15.                         Average rating is 6.762 out of 10, and current popularity is 12.076.                                     Overview: 'To free Baba Yaga and Renfield from the clutches of Monster Hunter Mila Starr, the Wishbone Family once more transforms into a Vampire, Frankenstein's Monster, a Mummy and a Werewolf but when aided by their three pet bats, the Monster Family zooms around the world again to save their friends, make new monstrous acquaintances.'                                         Top cast includes: Emily Watson, Nick Frost, Jessica Brown Findlay, Ethan Rouse, Jason Isaacs. Genres: Animation, Family, Comedy. Streaming providers unkown."
Vanquish,804435,"Action, Adventure, Thriller","Ruby Rose, Morgan Freeman, Patrick Muldoon, Julie Lott, Ekaterina Baker",George Gallo,/AoWY1gkcNzabh229Icboa1Ff0BM.jpg,2021-04-16,"Movie 'Vanquish', directed by George Gallo, released on 2021-04-16.                         Average rating is 5.37 out of 10, and current popularity is 8.357.                                     Overview: 'Victoria is a young mother trying to put her dark past as a Russian drug courier behind her, but retired cop Damon forces Victoria to do his bidding by holding her daughter hostage. Now, Victoria must use guns, guts and a motorcycle to take out a series of violent gangsters—or she may never see her child again.'                                         Top cast includes: Ruby Rose, Morgan Freeman, Patrick Muldoon, Julie Lott, Ekaterina Baker. Genres: Action, Adventure, Thriller. Streaming providers unkown."
America: The Motion Picture,739542,"Animation, Action, Comedy","Channing Tatum, Jason Mantzoukas, Olivia Munn, Bobby Moynihan, Judy Greer",Matt Thompson,/1JRRvx5RotvWM1maeq9r82ktdHi.jpg,2021-06-30,"Movie 'America: The Motion Picture', directed by Matt Thompson, released on 2021-06-30.                         Average rating is 5.66 out of 10, and current popularity is 9.103.                                     Overview: 'A chainsaw-wielding George Washington teams with beer-loving bro Sam Adams to take down the Brits in a tongue-in-cheek riff on the American Revolution.'                                         Top cast includes: Channing Tatum, Jason Mantzoukas, Olivia Munn, Bobby Moynihan, Judy Greer. Genres: Animation, Action, Comedy.                                            Available on: Netflix, Netflix basic with Ads."
Under Wraps,763873,"Family, Comedy, Fantasy","Malachi Barton, Christian J. Simon, Sophia Hammons, Phil Wright, Melanie Brook",Alex Zamm,/2EnHRyHdboUWz120LDiAk2M2Lgc.jpg,2021-10-01,"Movie 'Under Wraps', directed by Alex Zamm, released on 2021-10-01.                         Average rating is 6.787 out of 10, and current popularity is 19.464.                                     Overview: 'Three friends try to save their mummified friend, Harold, from greedy criminals by returning him to his resting place before midnight on Halloween.'                                         Top cast includes: Malachi Barton, Christian J. Simon, Sophia Hammons, Phil Wright, Melanie Brook. Genres: Family, Comedy, Fantasy.                                            Available on: Disney Plus, fuboTV, DisneyNOW."
Mad God,846867,"Animation, Fantasy, Horror, Science Fiction, War","Alex Cox, Niketa Roman, Satish Ratakonda, Arne Hain, Jake Freytag",Phil Tippett,/X32TnGBup6HRSoY4RXbQEDhRh4.jpg,2022-06-16,"Movie 'Mad God', directed by Phil Tippett, released on 2022-06-16.                         Average rating is 6.886 out of 10, and current popularity is 11.348.                                     Overview: 'A figure known as ""The Assassin"" descends from the heavens into a nightmarish pit full of monsters, titans, and cruelty.'                                         Top cast includes: Alex Cox, Niketa Roman, Satish Ratakonda, Arne Hain, Jake Freytag. Genres: Animation, Fantasy, Horror, Science Fiction, War.                                            Available on: AMC+ Amazon Channel, Shudder, Shudder Amazon Channel, Shudder Apple TV Channel."
The White Tiger,628534,Drama,"Adarsh Gourav, Rajkummar Rao, Priyanka Chopra Jonas, Mahesh Manjrekar, Vijay Maurya",Ramin Bahrani,/5JnmseS3DZ6ad2VMbrnbGCs8Rst.jpg,2021-01-13,"Movie 'The White Tiger', directed by Ramin Bahrani, released on 2021-01-13.                         Average rating is 6.957 out of 10, and current popularity is 13.093.                                     Overview: 'An ambitious Indian driver uses his wit and cunning to escape from poverty and rise to the top. An epic journey based on the New York Times bestseller.'                                         Top cast includes: Adarsh Gourav, Rajkummar Rao, Priyanka Chopra Jonas, Mahesh Manjrekar, Vijay Maurya. Genres: Drama.                                            Available on: Netflix, Netflix basic with Ads."
Old Henry,785663,Western,"Tim Blake Nelson, Scott Haze, Gavin Lewis, Stephen Dorff, Trace Adkins",Potsy Ponciroli,/eE1SL0QoDsvAMqQly56IkRtlN1W.jpg,2021-10-01,"Movie 'Old Henry', directed by Potsy Ponciroli, released on 2021-10-01.                         Average rating is 7.273 out of 10, and current popularity is 18.096.                                     Overview: 'A widowed farmer and his son warily take in a mysterious, injured man with a satchel of cash. When a posse of men claiming to be the law come for the money, the farmer must decide who to trust. Defending a siege of his homestead, the farmer reveals a talent for gun-slinging that surprises everyone calling his true identity into question.'                                         Top cast includes: Tim Blake Nelson, Scott Haze, Gavin Lewis, Stephen Dorff, Trace Adkins. Genres: Western. Streaming providers unkown."
Naked Singularity,624789,"Crime, Drama","John Boyega, Olivia Cooke, Bill Skarsgård, Ed Skrein, Linda Lavin",Chase Palmer,/iJwnO2Tou9hwgy1olFn3JcCj7Sx.jpg,2021-08-06,"Movie 'Naked Singularity', directed by Chase Palmer, released on 2021-08-06.                         Average rating is 4.5 out of 10, and current popularity is 10.318.                                     Overview: 'When a successful New York public defender loses his first case, he is pulled into a drug heist by a former client in an effort to beat the broken system at its own game.'                                         Top cast includes: John Boyega, Olivia Cooke, Bill Skarsgård, Ed Skrein, Linda Lavin. Genres: Crime, Drama.                                            Available on: Starz Apple TV Channel, Starz Roku Premium Channel, Starz, Starz Amazon Channel."
Mainstream,557950,"Comedy, Drama","Andrew Garfield, Maya Hawke, Nat Wolff, Jason Schwartzman, Johnny Knoxville",Gia Coppola,/9KXWDsbbp2dcjMNzYRzkuRfrpzc.jpg,2021-05-07,"Movie 'Mainstream', directed by Gia Coppola, released on 2021-05-07.                         Average rating is 6.4 out of 10, and current popularity is 19.303.                                     Overview: 'A young woman thinks she’s found a path to internet stardom when she starts making YouTube videos with a charismatic stranger  – until the dark side of viral celebrity threatens to ruin them both.'                                         Top cast includes: Andrew Garfield, Maya Hawke, Nat Wolff, Jason Schwartzman, Johnny Knoxville. Genres: Comedy, Drama.                                            Available on: YouTube."
Breaking News in Yuba County,556867,"Comedy, Drama, Crime","Allison Janney, Mila Kunis, Regina Hall, Awkwafina, Wanda Sykes",Tate Taylor,/pMyCYtgfBmMisX3RFc5eH6zIV5Y.jpg,2021-02-12,"Movie 'Breaking News in Yuba County', directed by Tate Taylor, released on 2021-02-12.                         Average rating is 5.747 out of 10, and current popularity is 10.58.                                     Overview: 'An overlooked pencil-pusher catches her husband in bed with another woman, the shock of which causes him to die of a heart attack. So she buries his body and takes advantage of the growing celebrity status that comes from having a missing husband. But she quickly finds herself in over her head, dodging cops and criminals, all while trying to keep the truth from her sister, a local news anchor who’s desperate for a story.'                                         Top cast includes: Allison Janney, Mila Kunis, Regina Hall, Awkwafina, Wanda Sykes. Genres: Comedy, Drama, Crime. Streaming providers unkown."
Scooby-Doo! The Sword and the Scoob,682254,"Animation, Comedy, Family, Mystery, Adventure, Fantasy","Grey DeLisle, Stephen Stanton, Kari Wahlgren, Frank Welker, Kate Micucci",Christina Sotta,/sCoG0ibohbPrnyomtzegSuBL40L.jpg,2021-02-23,"Movie 'Scooby-Doo! The Sword and the Scoob', directed by Christina Sotta, released on 2021-02-23.                         Average rating is 7.674 out of 10, and current popularity is 12.075.                                     Overview: 'An evil sorceress transports the gang back to the age of chivalrous knights, spell-casting wizards, and fire-breathing dragons.'                                         Top cast includes: Grey DeLisle, Stephen Stanton, Kari Wahlgren, Frank Welker, Kate Micucci. Genres: Animation, Comedy, Family, Mystery, Adventure, Fantasy. Streaming providers unkown."
Robin Robin,649928,"Animation, Adventure, Family","Bronte Carmichael, Richard E. Grant, Gillian Anderson, Adeel Akhtar, Amira Macey-Michael",Mikey Please,/bKIdlJbd17rrIm4oZzhXTbmqpon.jpg,2021-11-27,"Movie 'Robin Robin', directed by Mikey Please, released on 2021-11-27.                         Average rating is 7.1 out of 10, and current popularity is 18.319.                                     Overview: 'A bird raised by mice begins to question where she belongs and sets off on a daring journey of self-discovery.'                                         Top cast includes: Bronte Carmichael, Richard E. Grant, Gillian Anderson, Adeel Akhtar, Amira Macey-Michael. Genres: Animation, Adventure, Family.                                            Available on: Netflix, Netflix basic with Ads."
Biggie: I Got a Story to Tell,797309,"Documentary, Music","The Notorious B.I.G., Sean Combs, Faith Evans, Damion Butler, Voletta Wallace",Emmett Malloy,/wwMZiuoucmdVxZmj4HjYSLwAFJh.jpg,2021-03-01,"Movie 'Biggie: I Got a Story to Tell', directed by Emmett Malloy, released on 2021-03-01.                         Average rating is 7.2 out of 10, and current popularity is 13.054.                                     Overview: 'Christopher Wallace, AKA The Notorious B.I.G., remains one of Hip-Hop’s icons, renowned for his distinctive flow and autobiographical lyrics. This documentary celebrates his life via rare behind-the-scenes footage and the testimonies of his closest friends and family.'                                         Top cast includes: The Notorious B.I.G., Sean Combs, Faith Evans, Damion Butler, Voletta Wallace. Genres: Documentary, Music.                                            Available on: Netflix, Netflix basic with Ads."
Mickey and Minnie Wish Upon a Christmas,864390,"Animation, TV Movie, Comedy","Bret Iwan, Kaitlyn Robrock, Bill Farmer, Daniel Ross, Tress MacNeille",Broni Likomanov,/viZ3SvvQi7CRHJxnSKAG2lHU4AK.jpg,2021-12-02,"Movie 'Mickey and Minnie Wish Upon a Christmas', directed by Broni Likomanov, released on 2021-12-02.                         Average rating is 7.0 out of 10, and current popularity is 13.052.                                     Overview: 'After a series of mishaps, Mickey, Minnie and the gang are separated all over the world and must try to get back to Hot Dog Hills by Christmas Eve. A mysterious and jolly stranger shows up to tell them about The Wishing Star, which could be the secret to bringing everybody home in time to celebrate together.'                                         Top cast includes: Bret Iwan, Kaitlyn Robrock, Bill Farmer, Daniel Ross, Tress MacNeille. Genres: Animation, TV Movie, Comedy.                                            Available on: Disney Plus."
The Virtuoso,808023,"Thriller, Crime, Action","Anthony Hopkins, Anson Mount, Abbie Cornish, Diora Baird, Eddie Marsan",Nick Stagliano,/vXHzO26mJaOt4VO7ZFiM6No5ScT.jpg,2021-04-30,"Movie 'The Virtuoso', directed by Nick Stagliano, released on 2021-04-30.                         Average rating is 5.96 out of 10, and current popularity is 13.545.                                     Overview: 'Danger, deception and murder descend upon a sleepy town when a professional assassin accepts a new assignment from his enigmatic boss.'                                         Top cast includes: Anthony Hopkins, Anson Mount, Abbie Cornish, Diora Baird, Eddie Marsan. Genres: Thriller, Crime, Action. Streaming providers unkown."
Caveat,744746,"Horror, Mystery","Jonathan French, Leila Sykes, Ben Caplan, Conor Dwane, Inma Pavon",Damian Mc Carthy,/nbug05AceVU8PMXIONDFxMRtq54.jpg,2020-10-10,"Movie 'Caveat', directed by Damian Mc Carthy, released on 2020-10-10.                         Average rating is 6.14 out of 10, and current popularity is 14.042.                                     Overview: 'A lone drifter suffering from partial memory loss accepts a job to look after a psychologically troubled woman in an abandoned house on an isolated island.'                                         Top cast includes: Jonathan French, Leila Sykes, Ben Caplan, Conor Dwane, Inma Pavon. Genres: Horror, Mystery.                                            Available on: AMC+ Amazon Channel, AMC+, Shudder, Shudder Amazon Channel, Shudder Apple TV Channel."
Cosmic Sin,681887,"Science Fiction, Action, Adventure","Bruce Willis, Adelaide Kane, Frank Grillo, Lochlyn Munro, Costas Mandylor",Edward Drake,/6Wm7P6y22UZA40QuPYHyWyJ6leI.jpg,2021-03-12,"Movie 'Cosmic Sin', directed by Edward Drake, released on 2021-03-12.                         Average rating is 4.054 out of 10, and current popularity is 15.031.                                     Overview: 'In the year 2524, four centuries after humans started colonizing the outer planets, retired General James Ford gets called back into service when a hostile alien fleet attacks soldiers on a remote planet. The threat against mankind soon escalates into an interstellar war as Ford and a team of elite soldiers try to stop the imminent attack before it's too late.'                                         Top cast includes: Bruce Willis, Adelaide Kane, Frank Grillo, Lochlyn Munro, Costas Mandylor. Genres: Science Fiction, Action, Adventure. Streaming providers unkown."
9/11: Inside the President's War Room,848981,"Documentary, History","George W. Bush, Dick Cheney, Condoleezza Rice, Colin Powell, Norman Mineta",Adam Wishart,/u9eEPzGEXu92DLSJzOv6HX5QvND.jpg,2021-08-31,"Movie '9/11: Inside the President's War Room', directed by Adam Wishart, released on 2021-08-31.                         Average rating is 6.88 out of 10, and current popularity is 8.41.                                     Overview: 'Experience the events of September 11, 2001 through the eyes of President Bush and his closest advisors as they personally detail the crucial hours and key decisions from that historic day.'                                         Top cast includes: George W. Bush, Dick Cheney, Condoleezza Rice, Colin Powell, Norman Mineta. Genres: Documentary, History.                                            Available on: Apple TV Plus."
Justice Society: World War II,736069,"Animation, War, Science Fiction","Stana Katic, Matt Bomer, Chris Diamantopoulos, Darren Criss, Elysia Rotaru",Jeff Wamester,/e4REOC6CZW8J6FslA4nRvdQXFXR.jpg,2021-04-27,"Movie 'Justice Society: World War II', directed by Jeff Wamester, released on 2021-04-27.                         Average rating is 7.431 out of 10, and current popularity is 11.027.                                     Overview: 'When the Flash finds himself dropped into the middle of World War II, he joins forces with Wonder Woman and her top-secret team known as the Justice Society of America.'                                         Top cast includes: Stana Katic, Matt Bomer, Chris Diamantopoulos, Darren Criss, Elysia Rotaru. Genres: Animation, War, Science Fiction. Streaming providers unkown."
The Banishing,573680,Horror,"Jessica Brown Findlay, John Heffernan, John Lynch, Sean Harris, Jason Thorpe",Christopher Smith,/wBvubEmOBRwA0HolPanqjMaMjfk.jpg,2020-10-12,"Movie 'The Banishing', directed by Christopher Smith, released on 2020-10-12.                         Average rating is 5.2 out of 10, and current popularity is 18.658.                                     Overview: 'In the 1930s, a young reverend and his family are forced to confront their worst fears when they discover their new home holds a horrifying secret.'                                         Top cast includes: Jessica Brown Findlay, John Heffernan, John Lynch, Sean Harris, Jason Thorpe. Genres: Horror.                                            Available on: Shudder, Shudder Amazon Channel, Shudder Apple TV Channel."
