title,id,genres,cast,director,poster_path,release_date,semantic_field
Spider-Man: No Way Home,634649,"Action, Adventure, Science Fiction","Tom Holland, Zendaya, Benedict Cumberbatch, Jacob Batalon, Jamie Foxx",Jon Watts,/1g0dhYtq4irTY1GPXvft6k4YLjm.jpg,2021-12-17,"Movie 'Spider-Man: No Way Home', directed by Jon Watts, released on 2021-12-17.                         Average rating is 7.96 out of 10, and current popularity is 184.591.                                     Overview: 'Peter Parker is unmasked and no longer able to separate his normal life from the high-stakes of being a super-hero. When he asks for help from Doctor Strange the stakes become even more dangerous, forcing him to discover what it truly means to be Spider-Man.'                                         Top cast includes: Tom Holland, Zendaya, Benedict Cumberbatch, Jacob Batalon, Jamie Foxx. Genres: Action, Adventure, Science Fiction.                                            Available on: fuboTV."
Infinite,581726,"Science Fiction, Action, Adventure, Thriller","Mark Wahlberg, Chiwetel Ejiofor, Sophie Cookson, Jason Mantzoukas, Rupert Friend",Antoine Fuqua,/niw2AKHz6XmwiRMLWaoyAOAti0G.jpg,2021-06-10,"Movie 'Infinite', directed by Antoine Fuqua, released on 2021-06-10.                         Average rating is 6.619 out of 10, and current popularity is 148.414.                                     Overview: 'Evan McCauley has skills he never learned and memories of places he has never visited. Self-medicated and on the brink of a mental breakdown, a secret group that call themselves “Infinites” come to his rescue, revealing that his memories are real.'                                         Top cast includes: Mark Wahlberg, Chiwetel Ejiofor, Sophie Cookson, Jason Mantzoukas, Rupert Friend. Genres: Science Fiction, Action, Adventure, Thriller. Streaming providers unkown."
Venom: Let There Be Carnage,580489,"Science Fiction, Action, Adventure","Tom Hardy, Woody Harrelson, Michelle Williams, Naomie Harris, Reid Scott",Andy Serkis,/1MJNcPZy46hIy2CmSqOeru0yr5C.jpg,2021-10-01,"Movie 'Venom: Let There Be Carnage', directed by Andy Serkis, released on 2021-10-01.                         Average rating is 6.796 out of 10, and current popularity is 161.997.                                     Overview: 'After finding a host body in investigative reporter Eddie Brock, the alien symbiote must face a new enemy, Carnage, the alter ego of serial killer Cletus Kasady.'                                         Top cast includes: Tom Hardy, Woody Harrelson, Michelle Williams, Naomie Harris, Reid Scott. Genres: Science Fiction, Action, Adventure.                                            Available on: fuboTV."
Shang-Chi and the Legend of the Ten Rings,566525,"Action, Adventure, Fantasy","Simu Liu, Tony Leung Chiu-wai, Awkwafina, Ben Kingsley, Meng'er Zhang",Destin Daniel Cretton,/9f2Q0U3IOsLgrI2HkvldwSABZy5.jpg,2021-09-03,"Movie 'Shang-Chi and the Legend of the Ten Rings', directed by Destin Daniel Cretton, released on 2021-09-03.                         Average rating is 7.5 out of 10, and current popularity is 104.653.                                     Overview: 'Shang-Chi must confront the past he thought he left behind when he is drawn into the web of the mysterious Ten Rings organization.'                                         Top cast includes: Simu Liu, Tony Leung Chiu-wai, Awkwafina, Ben Kingsley, Meng'er Zhang. Genres: Action, Adventure, Fantasy.                                            Available on: Disney Plus."
Free Guy,550988,"Comedy, Adventure, Science Fiction","Ryan Reynolds, Jodie Comer, Joe Keery, Lil Rel Howery, Utkarsh Ambudkar",Shawn Levy,/xmbU4JTUm8rsdtn7Y3Fcm30GpeT.jpg,2021-08-13,"Movie 'Free Guy', directed by Shawn Levy, released on 2021-08-13.                         Average rating is 7.501 out of 10, and current popularity is 101.987.                                     Overview: 'A bank teller discovers he is actually a background player in an open-world video game, and decides to become the hero of his own story. Now, in a world where there are no limits, he is determined to be the guy who saves his world his way before it's too late.'                                         Top cast includes: Ryan Reynolds, Jodie Comer, Joe Keery, Lil Rel Howery, Utkarsh Ambudkar. Genres: Comedy, Adventure, Science Fiction.                                            Available on: Disney Plus, fuboTV."
Encanto,568124,"Animation, Comedy, Family, Fantasy","Stephanie Beatriz, María Cecilia Botero, John Leguizamo, Diane Guerrero, Jessica Darrow",Byron Howard,/4j0PNHkMr5ax3IA8tjtxcmPU3QT.jpg,2021-11-24,"Movie 'Encanto', directed by Byron Howard, released on 2021-11-24.                         Average rating is 7.601 out of 10, and current popularity is 110.313.                                     Overview: 'The tale of an extraordinary family, the Madrigals, who live hidden in the mountains of Colombia, in a magical house, in a vibrant town, in a wondrous, charmed place called an Encanto. The magic of the Encanto has blessed every child in the family—every child except one, Mirabel. But when she discovers that the magic surrounding the Encanto is in danger, Mirabel decides that she, the only ordinary Madrigal, might just be her exceptional family's last hope.'                                         Top cast includes: Stephanie Beatriz, María Cecilia Botero, John Leguizamo, Diane Guerrero, Jessica Darrow. Genres: Animation, Comedy, Family, Fantasy.                                            Available on: Disney Plus."
Meteor,870404,"Science Fiction, Thriller","Robert Keith, Olivia Nash, Thom Hallum, Allyn Carrell, Jordan Walker Ross",Brett Bentman,/tVMddOS5bi3YPVPgTPlEw0TOWoF.jpg,2021-09-01,"Movie 'Meteor', directed by Brett Bentman, released on 2021-09-01.                         Average rating is 5.479 out of 10, and current popularity is 106.14.                                     Overview: 'After a meteor collides into Earth, a lonely rancher and a lost young girl are on the run from vicious mercenaries.'                                         Top cast includes: Robert Keith, Olivia Nash, Thom Hallum, Allyn Carrell, Jordan Walker Ross. Genres: Science Fiction, Thriller.                                            Available on: Amazon Prime Video with Ads."
The Conjuring: The Devil Made Me Do It,423108,"Horror, Mystery, Thriller","Patrick Wilson, Vera Farmiga, Ruairí O'Connor, Sarah Catherine Hook, Julian Hilliard",Michael Chaves,/xbSuFiJbbBWCkyCCKIMfuDCA4yV.jpg,2021-06-04,"Movie 'The Conjuring: The Devil Made Me Do It', directed by Michael Chaves, released on 2021-06-04.                         Average rating is 7.438 out of 10, and current popularity is 85.11.                                     Overview: 'Paranormal investigators Ed and Lorraine Warren encounter what would become one of the most sensational cases from their files. The fight for the soul of a young boy takes them beyond anything they'd ever seen before, to mark the first time in U.S. history that a murder suspect would claim demonic possession as a defense.'                                         Top cast includes: Patrick Wilson, Vera Farmiga, Ruairí O'Connor, Sarah Catherine Hook, Julian Hilliard. Genres: Horror, Mystery, Thriller.                                            Available on: Max, Max Amazon Channel."
Sing 2,438695,"Animation, Family, Music, Comedy","Matthew McConaughey, Reese Witherspoon, Scarlett Johansson, Taron Egerton, Bobby Cannavale",Garth Jennings,/aWeKITRFbbwY8txG5uCj4rMCfSP.jpg,2021-12-22,"Movie 'Sing 2', directed by Garth Jennings, released on 2021-12-22.                         Average rating is 7.866 out of 10, and current popularity is 70.712.                                     Overview: 'Buster and his new cast now have their sights set on debuting a new show at the Crystal Tower Theater in glamorous Redshore City. But with no connections, he and his singers must sneak into the Crystal Entertainment offices, run by the ruthless wolf mogul Jimmy Crystal, where the gang pitches the ridiculous idea of casting the lion rock legend Clay Calloway in their show. Buster must embark on a quest to find the now-isolated Clay and persuade him to return to the stage.'                                         Top cast includes: Matthew McConaughey, Reese Witherspoon, Scarlett Johansson, Taron Egerton, Bobby Cannavale. Genres: Animation, Family, Music, Comedy. Streaming providers unkown."
The Suicide Squad,436969,"Action, Comedy, Adventure","Margot Robbie, Idris Elba, John Cena, Joel Kinnaman, Sylvester Stallone",James Gunn,/kb4s0ML0iVZlG6wAKbbs9NAm6X.jpg,2021-08-06,"Movie 'The Suicide Squad', directed by James Gunn, released on 2021-08-06.                         Average rating is 7.512 out of 10, and current popularity is 82.508.                                     Overview: 'Supervillains Harley Quinn, Bloodsport, Peacemaker and a collection of nutty cons at Belle Reve prison join the super-secret, super-shady Task Force X as they are dropped off at the remote, enemy-infused island of Corto Maltese.'                                         Top cast includes: Margot Robbie, Idris Elba, John Cena, Joel Kinnaman, Sylvester Stallone. Genres: Action, Comedy, Adventure.                                            Available on: Max, Max Amazon Channel."
Dune,438631,"Science Fiction, Adventure","Timothée Chalamet, Rebecca Ferguson, Oscar Isaac, Jason Momoa, Stellan Skarsgård",Denis Villeneuve,/d5NXSklXo0qyIYkgV94XAgMIckC.jpg,2021-10-22,"Movie 'Dune', directed by Denis Villeneuve, released on 2021-10-22.                         Average rating is 7.785 out of 10, and current popularity is 100.234.                                     Overview: 'Paul Atreides, a brilliant and gifted young man born into a great destiny beyond his understanding, must travel to the most dangerous planet in the universe to ensure the future of his family and his people. As malevolent forces explode into conflict over the planet's exclusive supply of the most precious resource in existence-a commodity capable of unlocking humanity's greatest potential-only those who can conquer their fear will survive.'                                         Top cast includes: Timothée Chalamet, Rebecca Ferguson, Oscar Isaac, Jason Momoa, Stellan Skarsgård. Genres: Science Fiction, Adventure.                                            Available on: Max, Max Amazon Channel, TNT, TBS."
The Boss Baby: Family Business,459151,"Animation, Comedy, Adventure, Family","Alec Baldwin, James Marsden, Amy Sedaris, Ariana Greenblatt, Jeff Goldblum",Tom McGrath,/kv2Qk9MKFFQo4WQPaYta599HkJP.jpg,2021-07-02,"Movie 'The Boss Baby: Family Business', directed by Tom McGrath, released on 2021-07-02.                         Average rating is 7.375 out of 10, and current popularity is 62.514.                                     Overview: 'The Templeton brothers — Tim and his Boss Baby little bro Ted — have become adults and drifted away from each other. But a new boss baby with a cutting-edge approach and a can-do attitude is about to bring them together again … and inspire a new family business.'                                         Top cast includes: Alec Baldwin, James Marsden, Amy Sedaris, Ariana Greenblatt, Jeff Goldblum. Genres: Animation, Comedy, Adventure, Family.                                            Available on: Paramount Plus, Paramount Plus Apple TV Channel , Paramount+ Amazon Channel, Paramount+ Roku Premium Channel."
Girl in the Basement,801335,"Thriller, Crime, TV Movie","Judd Nelson, Stefanie Scott, Joely Fisher, Braxton Bjerken, Kim Rosen",Elisabeth Röhm,/qmddUxRwbsxHa7oEXm4PWh1KZe8.jpg,2021-02-27,"Movie 'Girl in the Basement', directed by Elisabeth Röhm, released on 2021-02-27.                         Average rating is 7.687 out of 10, and current popularity is 82.916.                                     Overview: 'Sara is a teen girl who is looking forward to her 18th birthday to move away from her controlling father Don. But before she could even blow out the candles, Don imprisons her in the basement of their home.'                                         Top cast includes: Judd Nelson, Stefanie Scott, Joely Fisher, Braxton Bjerken, Kim Rosen. Genres: Thriller, Crime, TV Movie.                                            Available on: Hulu, Lifetime Movie Club, A&E Crime Central Apple TV Channel, Lifetime Movie Club Apple TV Channel, Lifetime Movie Club Amazon Channel."
Wrong Turn,630586,"Horror, Thriller","Charlotte Vega, Adain Bradley, Bill Sage, Emma Dumont, Dylan McTee",Mike P. Nelson,/4U1SBHmwHkNA0eHZ2n1CuiC1K1g.jpg,2021-02-23,"Movie 'Wrong Turn', directed by Mike P. Nelson, released on 2021-02-23.                         Average rating is 5.972 out of 10, and current popularity is 68.962.                                     Overview: 'Jen and a group of friends set out to hike the Appalachian Trail. Despite warnings to stick to the trail, the hikers stray off course—and cross into land inhabited by The Foundation, a hidden community of mountain dwellers who use deadly means to protect their way of life.'                                         Top cast includes: Charlotte Vega, Adain Bradley, Bill Sage, Emma Dumont, Dylan McTee. Genres: Horror, Thriller.                                            Available on: fuboTV, Paramount+ with Showtime, Paramount Plus Apple TV Channel , Paramount+ Amazon Channel, Paramount+ Roku Premium Channel."
Wrath of Man,637649,"Crime, Action, Thriller","Jason Statham, Holt McCallany, Josh Hartnett, Scott Eastwood, Darrell D'Silva",Guy Ritchie,/M7SUK85sKjaStg4TKhlAVyGlz3.jpg,2021-05-07,"Movie 'Wrath of Man', directed by Guy Ritchie, released on 2021-05-07.                         Average rating is 7.631 out of 10, and current popularity is 77.557.                                     Overview: 'A cold and mysterious new security guard for a Los Angeles cash truck company surprises his co-workers when he unleashes precision skills during a heist. The crew is left wondering who he is and where he came from. Soon, the marksman's ultimate motive becomes clear as he takes dramatic and irrevocable steps to settle a score.'                                         Top cast includes: Jason Statham, Holt McCallany, Josh Hartnett, Scott Eastwood, Darrell D'Silva. Genres: Crime, Action, Thriller. Streaming providers unkown."
F9,385128,"Action, Adventure, Crime","Vin Diesel, Michelle Rodriguez, Tyrese Gibson, Ludacris, John Cena",Justin Lin,/bOFaAXmWWXC3Rbv4u4uM9ZSzRXP.jpg,2021-06-25,"Movie 'F9', directed by Justin Lin, released on 2021-06-25.                         Average rating is 7.08 out of 10, and current popularity is 61.889.                                     Overview: 'Dominic Toretto and his crew battle the most skilled assassin and high-performance driver they've ever encountered: his forsaken brother.'                                         Top cast includes: Vin Diesel, Michelle Rodriguez, Tyrese Gibson, Ludacris, John Cena. Genres: Action, Adventure, Crime.                                            Available on: fuboTV, Peacock Premium, NBC, USA Network, Peacock Premium Plus."
Luca,508943,"Animation, Comedy, Fantasy, Adventure, Family","Jacob Tremblay, Jack Dylan Grazer, Emma Berman, Saverio Raimondo, Maya Rudolph",Enrico Casarosa,/9x4i9uKGXt8IiiIF5Ey0DIoY738.jpg,2024-03-22,"Movie 'Luca', directed by Enrico Casarosa, released on 2024-03-22.                         Average rating is 7.821 out of 10, and current popularity is 61.661.                                     Overview: 'Luca and his best friend Alberto experience an unforgettable summer on the Italian Riviera. But all the fun is threatened by a deeply-held secret: they are sea monsters from another world just below the water’s surface.'                                         Top cast includes: Jacob Tremblay, Jack Dylan Grazer, Emma Berman, Saverio Raimondo, Maya Rudolph. Genres: Animation, Comedy, Fantasy, Adventure, Family.                                            Available on: Disney Plus."
A Quiet Place Part II,520763,"Science Fiction, Thriller, Horror","Emily Blunt, John Krasinski, Millicent Simmonds, Noah Jupe, Cillian Murphy",John Krasinski,/4q2hz2m8hubgvijz8Ez0T2Os2Yv.jpg,2021-05-28,"Movie 'A Quiet Place Part II', directed by John Krasinski, released on 2021-05-28.                         Average rating is 7.492 out of 10, and current popularity is 78.032.                                     Overview: 'Following the events at home, the Abbott family now face the terrors of the outside world. Forced to venture into the unknown, they realize that the creatures that hunt by sound are not the only threats that lurk beyond the sand path.'                                         Top cast includes: Emily Blunt, John Krasinski, Millicent Simmonds, Noah Jupe, Cillian Murphy. Genres: Science Fiction, Thriller, Horror.                                            Available on: Paramount Plus, Paramount Plus Apple TV Channel , Paramount+ Amazon Channel, Paramount+ Roku Premium Channel."
Zack Snyder's Justice League,791373,"Action, Adventure, Fantasy","Ben Affleck, Henry Cavill, Gal Gadot, Ray Fisher, Jason Momoa",Zack Snyder,/tnAuB8q5vv7Ax9UAEje5Xi4BXik.jpg,2021-03-18,"Movie 'Zack Snyder's Justice League', directed by Zack Snyder, released on 2021-03-18.                         Average rating is 8.145 out of 10, and current popularity is 82.312.                                     Overview: 'Determined to ensure Superman's ultimate sacrifice was not in vain, Bruce Wayne aligns forces with Diana Prince with plans to recruit a team of metahumans to protect the world from an approaching threat of catastrophic proportions.'                                         Top cast includes: Ben Affleck, Henry Cavill, Gal Gadot, Ray Fisher, Jason Momoa. Genres: Action, Adventure, Fantasy.                                            Available on: Max, Max Amazon Channel."
Raya and the Last Dragon,527774,"Animation, Family, Fantasy, Action, Adventure","Kelly Marie Tran, Awkwafina, Gemma Chan, Alan Tudyk, Izaac Wang",Don Hall,/lPsD10PP4rgUGiGR4CCXA6iY0QQ.jpg,2021-03-05,"Movie 'Raya and the Last Dragon', directed by Don Hall, released on 2021-03-05.                         Average rating is 7.848 out of 10, and current popularity is 62.56.                                     Overview: 'Long ago, in the fantasy world of Kumandra, humans and dragons lived together in harmony. But when an evil force threatened the land, the dragons sacrificed themselves to save humanity. Now, 500 years later, that same evil has returned and it’s up to a lone warrior, Raya, to track down the legendary last dragon to restore the fractured land and its divided people.'                                         Top cast includes: Kelly Marie Tran, Awkwafina, Gemma Chan, Alan Tudyk, Izaac Wang. Genres: Animation, Family, Fantasy, Action, Adventure.                                            Available on: Disney Plus."
The Tomorrow War,588228,"Action, Science Fiction, Adventure","Chris Pratt, Yvonne Strahovski, J.K. Simmons, Betty Gilpin, Sam Richardson",Chris McKay,/34nDCQZwaEvsy4CFO5hkGRFDCVU.jpg,2021-06-30,"Movie 'The Tomorrow War', directed by Chris McKay, released on 2021-06-30.                         Average rating is 7.532 out of 10, and current popularity is 63.816.                                     Overview: 'The world is stunned when a group of time travelers arrive from the year 2051 to deliver an urgent message: Thirty years in the future, mankind is losing a global war against a deadly alien species. The only hope for survival is for soldiers and civilians from the present to be transported to the future and join the fight. Among those recruited is high school teacher and family man Dan Forester. Determined to save the world for his young daughter, Dan teams up with a brilliant scientist and his estranged father in a desperate quest to rewrite the fate of the planet.'                                         Top cast includes: Chris Pratt, Yvonne Strahovski, J.K. Simmons, Betty Gilpin, Sam Richardson. Genres: Action, Science Fiction, Adventure.                                            Available on: Amazon Prime Video, Amazon Prime Video with Ads."
The King's Man,476669,"Action, Comedy, Adventure, Thriller","Ralph Fiennes, Gemma Arterton, Rhys Ifans, Matthew Goode, Tom Hollander",Matthew Vaughn,/aq4Pwv5Xeuvj6HZKtxyd23e6bE9.jpg,2021-12-22,"Movie 'The King's Man', directed by Matthew Vaughn, released on 2021-12-22.                         Average rating is 6.754 out of 10, and current popularity is 61.765.                                     Overview: 'As a collection of history's worst tyrants and criminal masterminds gather to plot a war to wipe out millions, one man must race against time to stop them.'                                         Top cast includes: Ralph Fiennes, Gemma Arterton, Rhys Ifans, Matthew Goode, Tom Hollander. Genres: Action, Comedy, Adventure, Thriller.                                            Available on: Hulu, fuboTV."
Cruella,337404,"Comedy, Crime, Family, Adventure","Emma Stone, Emma Thompson, Joel Fry, Paul Walter Hauser, John McCrea",Craig Gillespie,/wToO8opxkGwKgSfJ1JK8tGvkG6U.jpg,2021-05-28,"Movie 'Cruella', directed by Craig Gillespie, released on 2021-05-28.                         Average rating is 8.011 out of 10, and current popularity is 63.936.                                     Overview: 'In 1970s London amidst the punk rock revolution, a young grifter named Estella is determined to make a name for herself with her designs. She befriends a pair of young thieves who appreciate her appetite for mischief, and together they are able to build a life for themselves on the London streets. One day, Estella’s flair for fashion catches the eye of the Baroness von Hellman, a fashion legend who is devastatingly chic and terrifyingly haute. But their relationship sets in motion a course of events and revelations that will cause Estella to embrace her wicked side and become the raucous, fashionable and revenge-bent Cruella.'                                         Top cast includes: Emma Stone, Emma Thompson, Joel Fry, Paul Walter Hauser, John McCrea. Genres: Comedy, Crime, Family, Adventure.                                            Available on: Disney Plus."
The Forever Purge,602223,"Horror, Action, Thriller","Ana de la Reguera, Josh Lucas, Willow Beuoy, Leven Rambin, Will Patton",Everardo Gout,/lB068qa6bQ0QKYKyC2xnYGvYjl7.jpg,2021-07-02,"Movie 'The Forever Purge', directed by Everardo Gout, released on 2021-07-02.                         Average rating is 6.949 out of 10, and current popularity is 58.413.                                     Overview: 'All the rules are broken as a sect of lawless marauders decides that the annual Purge does not stop at daybreak and instead should never end as they chase a group of immigrants who they want to punish because of their harsh historical past.'                                         Top cast includes: Ana de la Reguera, Josh Lucas, Willow Beuoy, Leven Rambin, Will Patton. Genres: Horror, Action, Thriller.                                            Available on: fuboTV, Peacock Premium, NBC, Peacock Premium Plus."
After We Fell,744275,"Romance, Drama","Josephine Langford, Hero Fiennes Tiffin, Louise Lombard, Chance Perdomo, Rob Estes",Castille Landon,/dU4HfnTEJDf9KvxGS9hgO7BVeju.jpg,2021-09-30,"Movie 'After We Fell', directed by Castille Landon, released on 2021-09-30.                         Average rating is 7.063 out of 10, and current popularity is 69.741.                                     Overview: 'Just as Tessa's life begins to become unglued, nothing is what she thought it would be. Not her friends nor her family. The only person that she should be able to rely on is Hardin, who is furious when he discovers the massive secret that she's been keeping. Before Tessa makes the biggest decision of her life, everything changes because of revelations about her family.'                                         Top cast includes: Josephine Langford, Hero Fiennes Tiffin, Louise Lombard, Chance Perdomo, Rob Estes. Genres: Romance, Drama.                                            Available on: Netflix, FilmBox+, Netflix basic with Ads."
Eternals,524434,"Science Fiction, Action, Adventure","Gemma Chan, Richard Madden, Angelina Jolie, Salma Hayek Pinault, Kumail Nanjiani",Chloé Zhao,/lFByFSLV5WDJEv3KabbdAF959F2.jpg,2021-11-05,"Movie 'Eternals', directed by Chloé Zhao, released on 2021-11-05.                         Average rating is 6.859 out of 10, and current popularity is 59.068.                                     Overview: 'The Eternals are a team of ancient aliens who have been living on Earth in secret for thousands of years. When an unexpected tragedy forces them out of the shadows, they are forced to reunite against mankind’s most ancient enemy, the Deviants.'                                         Top cast includes: Gemma Chan, Richard Madden, Angelina Jolie, Salma Hayek Pinault, Kumail Nanjiani. Genres: Science Fiction, Action, Adventure.                                            Available on: Disney Plus."
